{
  "schema_version": "1.0.0",
  "title": "Everyday clarity",
  "one_line_idea": "A simple daily moment becomes clearer.",
  "strategic_rationale": "Connect the benefit to a familiar use case.",
  "target_audience_insight": "Busy audiences value confidence.",
  "emotional_tone": "Warm and assured",
  "visual_world": "Natural light and uncluttered spaces",
  "narrative_arc": "Problem, clarity, confident action",
  "key_message": "Make the next choice easier.",
  "channel_fit": ["social"],
  "risks": [],
  "assumptions": []
}
